batchId,toolOrder,canonicalToolId,language,primaryKeyword,localizedSlug,localizedUrl,h1,metaTitle,metaDescription,source,status
B04,32,press-release-generator,id,generator press release,generator-press-release,https://taptogen.com/id/tools/generator-press-release/,Generator Press Release,Generator Press Release gratis,"Buat draf yang jelas dalam bahasa Indonesia dan tinjau hasil sebelum digunakan. Periksa akurasi, orisinalitas, kompatibilitas, dan aturan proyek sebelum menerbitkan. Periksa orisinalitas, sensitivitas, hak, dan ketersedi",built_dist,PASS
B04,32,press-release-generator,sv,generator for press release,generator-press-release,https://taptogen.com/sv/tools/generator-press-release/,Generator for Press Release,Generator for Press Release gratis,"Skapa tydliga utkast pa svenska och granska resultatet innan du anvander det. Kontrollera noggrannhet, originalitet, kompatibilitet och projektregler fore publicering. Kontrollera originalitet, kanslighet, rattigheter oc",built_dist,PASS
B04,32,press-release-generator,ms,penjana press release,penjana-press-release,https://taptogen.com/ms/tools/penjana-press-release/,Penjana Press Release,Penjana Press Release percuma,"Cipta draf jelas dalam Bahasa Melayu dan semak hasil sebelum digunakan. Semak ketepatan, keaslian, keserasian dan peraturan projek sebelum diterbitkan. Semak keaslian, sensitiviti, hak dan ketersediaan sebelum penggunaan",built_dist,PASS
B04,32,press-release-generator,bg,generator za press release,generator-press-release,https://taptogen.com/bg/tools/generator-press-release/,Generator za Press Release,Generator za Press Release bezplatno,"Sazdavaite yasni cherнови na balgarski i proveriavaite rezultata predi upotreba. Proverete tochnost, originalnost, savmestimost i pravilata na proekta predi publikuvane. Proverete originalnost, chuvstvitelnost, prava i d",built_dist,PASS
B04,32,press-release-generator,hi,press release जनरेटर,generator-press-release,https://taptogen.com/hi/tools/generator-press-release/,Press Release जनरेटर,Press Release जनरेटर मुफ्त,"हिंदी में साफ ड्राफ्ट बनाएं और उपयोग से पहले हर परिणाम की समीक्षा करें. प्रकाशन से पहले सटीकता, मौलिकता, संगतता और प्रोजेक्ट नियम जांचें. Public use se pehle originality, sensitivity, rights aur availability check karein",built_dist,PASS
B04,32,press-release-generator,bn,press release জেনারেটর,generator-press-release,https://taptogen.com/bn/tools/generator-press-release/,Press Release জেনারেটর,Press Release জেনারেটর ফ্রি,"বাংলায় পরিষ্কার খসড়া তৈরি করুন এবং ব্যবহারের আগে ফলাফল পর্যালোচনা করুন. প্রকাশের আগে নির্ভুলতা, মৌলিকতা, সামঞ্জস্য এবং প্রকল্পের নিয়ম যাচাই করুন. Public use er age originality, sensitivity, rights ebong availability chec",built_dist,PASS
B04,32,press-release-generator,ja,press release ジェネレーター,generator-press-release,https://taptogen.com/ja/tools/generator-press-release/,Press Release ジェネレーター,Press Release ジェネレーター 無料,"日本語でわかりやすい下書きを作り、使う前に結果を確認します. 公開前に正確性、独自性、互換性、プロジェクト規則を確認してください. Koukai riyou mae ni originality, hairyo, rights, availability wo kakunin shite kudasai. Public use no mae ni facts, permissions, brand, privacy, complianc",built_dist,PASS
B04,32,press-release-generator,ko,press release 생성기,generator-press-release,https://taptogen.com/ko/tools/generator-press-release/,Press Release 생성기,Press Release 생성기 무료,"한국어로 명확한 초안을 만들고 사용 전에 결과를 검토하세요. 게시 전에 정확성, 독창성, 호환성, 프로젝트 규칙을 확인하세요. Public use jeone originality, sensitivity, rights, availability reul hwaginhaseyo. Public use jeone facts, permissions, brand, privacy, compliance re",built_dist,PASS
B04,32,press-release-generator,ar,مولد press release,muwallid-press-release,https://taptogen.com/ar/tools/muwallid-press-release/,مولد Press Release,مولد Press Release مجانا,أنشئ مسودات عربية واضحة وراجع كل نتيجة قبل استخدامها. راجع الدقة والأصالة والتوافق وقواعد المشروع قبل النشر. Tahaqqaq min alasalah walhusasiyah walhuquq waltawafur qabla alistikhdam alam. Raji alhaqaiq waladhun walalama ,built_dist,PASS
B04,33,author-bio-generator,es,generador de author bio,generador-author-bio,https://taptogen.com/es/tools/generador-author-bio/,Generador de Author Bio,Generador de Author Bio gratis,"Crea borradores claros en español y revisa cada resultado antes de usarlo. Revisa exactitud, originalidad, compatibilidad y reglas del proyecto antes de publicar. Comprueba originalidad, sensibilidad, derechos y disponib",built_dist,PASS
B04,33,author-bio-generator,fr,générateur de author bio,generateur-author-bio,https://taptogen.com/fr/tools/generateur-author-bio/,Générateur de Author Bio,Générateur de Author Bio gratuit,"Créez des brouillons clairs en français et vérifiez chaque resultat avant usage. Verifiez exactitude, originalité, compatibilité et regles du projet avant publication. Verifiez originalité, sensibilite, droits et disponi",built_dist,PASS
B04,33,author-bio-generator,de,generator für author bio,generator-author-bio,https://taptogen.com/de/tools/generator-author-bio/,Generator für Author Bio,Generator für Author Bio kostenlos,"Erstelle klare Entwürfe auf Deutsch und prüfe jedes Ergebnis vor der Nutzung. Prüfe Genauigkeit, Originalitaet, Kompatibilität und Projektregeln vor der Veroeffentlichung. Prüfe Originalitaet, Sensibilitaet, Rechte ",built_dist,PASS
B04,33,author-bio-generator,pt,gerador de author bio,gerador-author-bio,https://taptogen.com/pt/tools/gerador-author-bio/,Gerador de Author Bio,Gerador de Author Bio gratis,"Crie rascunhos claros em português e revise cada resultado antes de usar. Revise precisao, originalidade, compatibilidade e regras do projeto antes de publicar. Verifique originalidade, sensibilidade, direitos e disponib",built_dist,PASS
B04,33,author-bio-generator,it,generatore di author bio,generatore-author-bio,https://taptogen.com/it/tools/generatore-author-bio/,Generatore di Author Bio,Generatore di Author Bio gratis,"Crea bozze chiare in italiano e controlla ogni risultato prima di usarlo. Controlla accuratezza, originalità, compatibilità e regole del progetto prima della pubblicazione. Controlla originalità, sensibilita, diritti e d",built_dist,PASS
B04,33,author-bio-generator,pl,generator author bio,generator-author-bio,https://taptogen.com/pl/tools/generator-author-bio/,Generator Author Bio,Generator Author Bio za darmo,"Twórz jasne wersje robocze po polsku i sprawdźaj wynik przed użyciem. Sprawdź dokładność, oryginalność, zgodność i zasady projektu przed publikacją. Sprawdź oryginalność, wrazliwosc, prawa i dostępność przed publicznym u",built_dist,PASS
B04,33,author-bio-generator,ru,generator author bio,generator-author-bio,https://taptogen.com/ru/tools/generator-author-bio/,Generator Author Bio,Generator Author Bio besplatno,"Sozdavaite ponyatnye chernoviki na russkom i proveriaite rezultat pered ispolzovaniem. Proverte tochnost, originalnost, sovmestimost i pravila proekta pered publikatsiei. Proverte originalnost, delikatnost, prava i dostu",built_dist,PASS
B04,33,author-bio-generator,tr,olusturucu author bio,olusturucu-author-bio,https://taptogen.com/tr/tools/olusturucu-author-bio/,Olusturucu Author Bio,Olusturucu Author Bio ucretsiz,"Turkce net taslaklar olusturun ve kullanmadan once sonucu kontrol edin. Yayinlamadan once dogruluk, ozgunluk, uyumluluk ve proje kurallarini kontrol edin. Halka acik kullanimdan once ozgunluk, hassasiyet, haklar ve uygun",built_dist,PASS
B04,33,author-bio-generator,id,generator author bio,generator-author-bio,https://taptogen.com/id/tools/generator-author-bio/,Generator Author Bio,Generator Author Bio gratis,"Buat draf yang jelas dalam bahasa Indonesia dan tinjau hasil sebelum digunakan. Periksa akurasi, orisinalitas, kompatibilitas, dan aturan proyek sebelum menerbitkan. Periksa orisinalitas, sensitivitas, hak, dan ketersedi",built_dist,PASS
B04,33,author-bio-generator,sv,generator for author bio,generator-author-bio,https://taptogen.com/sv/tools/generator-author-bio/,Generator for Author Bio,Generator for Author Bio gratis,"Skapa tydliga utkast pa svenska och granska resultatet innan du anvander det. Kontrollera noggrannhet, originalitet, kompatibilitet och projektregler fore publicering. Kontrollera originalitet, kanslighet, rattigheter oc",built_dist,PASS
B04,33,author-bio-generator,ms,penjana author bio,penjana-author-bio,https://taptogen.com/ms/tools/penjana-author-bio/,Penjana Author Bio,Penjana Author Bio percuma,"Cipta draf jelas dalam Bahasa Melayu dan semak hasil sebelum digunakan. Semak ketepatan, keaslian, keserasian dan peraturan projek sebelum diterbitkan. Semak keaslian, sensitiviti, hak dan ketersediaan sebelum penggunaan",built_dist,PASS
B04,33,author-bio-generator,bg,generator za author bio,generator-author-bio,https://taptogen.com/bg/tools/generator-author-bio/,Generator za Author Bio,Generator za Author Bio bezplatno,"Sazdavaite yasni cherнови na balgarski i proveriavaite rezultata predi upotreba. Proverete tochnost, originalnost, savmestimost i pravilata na proekta predi publikuvane. Proverete originalnost, chuvstvitelnost, prava i d",built_dist,PASS
B04,33,author-bio-generator,hi,author bio जनरेटर,generator-author-bio,https://taptogen.com/hi/tools/generator-author-bio/,Author Bio जनरेटर,Author Bio जनरेटर मुफ्त,"हिंदी में साफ ड्राफ्ट बनाएं और उपयोग से पहले हर परिणाम की समीक्षा करें. प्रकाशन से पहले सटीकता, मौलिकता, संगतता और प्रोजेक्ट नियम जांचें. Public use se pehle originality, sensitivity, rights aur availability check karein",built_dist,PASS
B04,33,author-bio-generator,bn,author bio জেনারেটর,generator-author-bio,https://taptogen.com/bn/tools/generator-author-bio/,Author Bio জেনারেটর,Author Bio জেনারেটর ফ্রি,"বাংলায় পরিষ্কার খসড়া তৈরি করুন এবং ব্যবহারের আগে ফলাফল পর্যালোচনা করুন. প্রকাশের আগে নির্ভুলতা, মৌলিকতা, সামঞ্জস্য এবং প্রকল্পের নিয়ম যাচাই করুন. Public use er age originality, sensitivity, rights ebong availability chec",built_dist,PASS
B04,33,author-bio-generator,ja,author bio ジェネレーター,generator-author-bio,https://taptogen.com/ja/tools/generator-author-bio/,Author Bio ジェネレーター,Author Bio ジェネレーター 無料,"日本語でわかりやすい下書きを作り、使う前に結果を確認します. 公開前に正確性、独自性、互換性、プロジェクト規則を確認してください. Koukai riyou mae ni originality, hairyo, rights, availability wo kakunin shite kudasai. Fake identity, impersonation, sensitive personal data ni tsukawana",built_dist,PASS
B04,33,author-bio-generator,ko,author bio 생성기,generator-author-bio,https://taptogen.com/ko/tools/generator-author-bio/,Author Bio 생성기,Author Bio 생성기 무료,"한국어로 명확한 초안을 만들고 사용 전에 결과를 검토하세요. 게시 전에 정확성, 독창성, 호환성, 프로젝트 규칙을 확인하세요. Public use jeone originality, sensitivity, rights, availability reul hwaginhaseyo. Fake identity, impersonation, sensitive personal data yongdo ro sa",built_dist,PASS
B04,33,author-bio-generator,ar,مولد author bio,muwallid-author-bio,https://taptogen.com/ar/tools/muwallid-author-bio/,مولد Author Bio,مولد Author Bio مجانا,أنشئ مسودات عربية واضحة وراجع كل نتيجة قبل استخدامها. راجع الدقة والأصالة والتوافق وقواعد المشروع قبل النشر. Tahaqqaq min alasalah walhusasiyah walhuquq waltawafur qabla alistikhdam alam. La tastakhdimha lihawiyah zaifah,built_dist,PASS
B04,34,viral-hook-generator,es,generador de viral hook,generador-viral-hook,https://taptogen.com/es/tools/generador-viral-hook/,Generador de Viral Hook,Generador de Viral Hook gratis,"Crea borradores claros en español y revisa cada resultado antes de usarlo. Revisa exactitud, originalidad, compatibilidad y reglas del proyecto antes de publicar. Comprueba originalidad, sensibilidad, derechos y disponib",built_dist,PASS
B04,34,viral-hook-generator,fr,générateur de viral hook,generateur-viral-hook,https://taptogen.com/fr/tools/generateur-viral-hook/,Générateur de Viral Hook,Générateur de Viral Hook gratuit,"Créez des brouillons clairs en français et vérifiez chaque resultat avant usage. Verifiez exactitude, originalité, compatibilité et regles du projet avant publication. Verifiez originalité, sensibilite, droits et disponi",built_dist,PASS
B04,34,viral-hook-generator,de,generator für viral hook,generator-viral-hook,https://taptogen.com/de/tools/generator-viral-hook/,Generator für Viral Hook,Generator für Viral Hook kostenlos,"Erstelle klare Entwürfe auf Deutsch und prüfe jedes Ergebnis vor der Nutzung. Prüfe Genauigkeit, Originalitaet, Kompatibilität und Projektregeln vor der Veroeffentlichung. Prüfe Originalitaet, Sensibilitaet, Rechte ",built_dist,PASS
B04,34,viral-hook-generator,pt,gerador de viral hook,gerador-viral-hook,https://taptogen.com/pt/tools/gerador-viral-hook/,Gerador de Viral Hook,Gerador de Viral Hook gratis,"Crie rascunhos claros em português e revise cada resultado antes de usar. Revise precisao, originalidade, compatibilidade e regras do projeto antes de publicar. Verifique originalidade, sensibilidade, direitos e disponib",built_dist,PASS
B04,34,viral-hook-generator,it,generatore di viral hook,generatore-viral-hook,https://taptogen.com/it/tools/generatore-viral-hook/,Generatore di Viral Hook,Generatore di Viral Hook gratis,"Crea bozze chiare in italiano e controlla ogni risultato prima di usarlo. Controlla accuratezza, originalità, compatibilità e regole del progetto prima della pubblicazione. Controlla originalità, sensibilita, diritti e d",built_dist,PASS
B04,34,viral-hook-generator,pl,generator viral hook,generator-viral-hook,https://taptogen.com/pl/tools/generator-viral-hook/,Generator Viral Hook,Generator Viral Hook za darmo,"Twórz jasne wersje robocze po polsku i sprawdźaj wynik przed użyciem. Sprawdź dokładność, oryginalność, zgodność i zasady projektu przed publikacją. Sprawdź oryginalność, wrazliwosc, prawa i dostępność przed publicznym u",built_dist,PASS
B04,34,viral-hook-generator,ru,generator viral hook,generator-viral-hook,https://taptogen.com/ru/tools/generator-viral-hook/,Generator Viral Hook,Generator Viral Hook besplatno,"Sozdavaite ponyatnye chernoviki na russkom i proveriaite rezultat pered ispolzovaniem. Proverte tochnost, originalnost, sovmestimost i pravila proekta pered publikatsiei. Proverte originalnost, delikatnost, prava i dostu",built_dist,PASS
B04,34,viral-hook-generator,tr,olusturucu viral hook,olusturucu-viral-hook,https://taptogen.com/tr/tools/olusturucu-viral-hook/,Olusturucu Viral Hook,Olusturucu Viral Hook ucretsiz,"Turkce net taslaklar olusturun ve kullanmadan once sonucu kontrol edin. Yayinlamadan once dogruluk, ozgunluk, uyumluluk ve proje kurallarini kontrol edin. Halka acik kullanimdan once ozgunluk, hassasiyet, haklar ve uygun",built_dist,PASS
B04,34,viral-hook-generator,id,generator viral hook,generator-viral-hook,https://taptogen.com/id/tools/generator-viral-hook/,Generator Viral Hook,Generator Viral Hook gratis,"Buat draf yang jelas dalam bahasa Indonesia dan tinjau hasil sebelum digunakan. Periksa akurasi, orisinalitas, kompatibilitas, dan aturan proyek sebelum menerbitkan. Periksa orisinalitas, sensitivitas, hak, dan ketersedi",built_dist,PASS
B04,34,viral-hook-generator,sv,generator for viral hook,generator-viral-hook,https://taptogen.com/sv/tools/generator-viral-hook/,Generator for Viral Hook,Generator for Viral Hook gratis,"Skapa tydliga utkast pa svenska och granska resultatet innan du anvander det. Kontrollera noggrannhet, originalitet, kompatibilitet och projektregler fore publicering. Kontrollera originalitet, kanslighet, rattigheter oc",built_dist,PASS
B04,34,viral-hook-generator,ms,penjana viral hook,penjana-viral-hook,https://taptogen.com/ms/tools/penjana-viral-hook/,Penjana Viral Hook,Penjana Viral Hook percuma,"Cipta draf jelas dalam Bahasa Melayu dan semak hasil sebelum digunakan. Semak ketepatan, keaslian, keserasian dan peraturan projek sebelum diterbitkan. Semak keaslian, sensitiviti, hak dan ketersediaan sebelum penggunaan",built_dist,PASS
B04,34,viral-hook-generator,bg,generator za viral hook,generator-viral-hook,https://taptogen.com/bg/tools/generator-viral-hook/,Generator za Viral Hook,Generator za Viral Hook bezplatno,"Sazdavaite yasni cherнови na balgarski i proveriavaite rezultata predi upotreba. Proverete tochnost, originalnost, savmestimost i pravilata na proekta predi publikuvane. Proverete originalnost, chuvstvitelnost, prava i d",built_dist,PASS
B04,34,viral-hook-generator,hi,viral hook जनरेटर,generator-viral-hook,https://taptogen.com/hi/tools/generator-viral-hook/,Viral Hook जनरेटर,Viral Hook जनरेटर मुफ्त,"हिंदी में साफ ड्राफ्ट बनाएं और उपयोग से पहले हर परिणाम की समीक्षा करें. प्रकाशन से पहले सटीकता, मौलिकता, संगतता और प्रोजेक्ट नियम जांचें. Public use se pehle originality, sensitivity, rights aur availability check karein",built_dist,PASS
B04,34,viral-hook-generator,bn,viral hook জেনারেটর,generator-viral-hook,https://taptogen.com/bn/tools/generator-viral-hook/,Viral Hook জেনারেটর,Viral Hook জেনারেটর ফ্রি,"বাংলায় পরিষ্কার খসড়া তৈরি করুন এবং ব্যবহারের আগে ফলাফল পর্যালোচনা করুন. প্রকাশের আগে নির্ভুলতা, মৌলিকতা, সামঞ্জস্য এবং প্রকল্পের নিয়ম যাচাই করুন. Public use er age originality, sensitivity, rights ebong availability chec",built_dist,PASS
B04,34,viral-hook-generator,ja,viral hook ジェネレーター,generator-viral-hook,https://taptogen.com/ja/tools/generator-viral-hook/,Viral Hook ジェネレーター,Viral Hook ジェネレーター 無料,"日本語でわかりやすい下書きを作り、使う前に結果を確認します. 公開前に正確性、独自性、互換性、プロジェクト規則を確認してください. Koukai riyou mae ni originality, hairyo, rights, availability wo kakunin shite kudasai. Reach, followers, sales, viral performance, platform result wa hos",built_dist,PASS
B04,34,viral-hook-generator,ko,viral hook 생성기,generator-viral-hook,https://taptogen.com/ko/tools/generator-viral-hook/,Viral Hook 생성기,Viral Hook 생성기 무료,"한국어로 명확한 초안을 만들고 사용 전에 결과를 검토하세요. 게시 전에 정확성, 독창성, 호환성, 프로젝트 규칙을 확인하세요. Public use jeone originality, sensitivity, rights, availability reul hwaginhaseyo. Reach, followers, sales, viral performance, platform result neun b",built_dist,PASS
B04,34,viral-hook-generator,ar,مولد viral hook,muwallid-viral-hook,https://taptogen.com/ar/tools/muwallid-viral-hook/,مولد Viral Hook,مولد Viral Hook مجانا,أنشئ مسودات عربية واضحة وراجع كل نتيجة قبل استخدامها. راجع الدقة والأصالة والتوافق وقواعد المشروع قبل النشر. Tahaqqaq min alasalah walhusasiyah walhuquq waltawafur qabla alistikhdam alam. La tadman alwusul aw almutabieen,built_dist,PASS
B04,35,content-calendar-generator,es,generador de content calendar,generador-content-calendar,https://taptogen.com/es/tools/generador-content-calendar/,Generador de Content Calendar,Generador de Content Calendar gratis,"Crea borradores claros en español y revisa cada resultado antes de usarlo. Revisa exactitud, originalidad, compatibilidad y reglas del proyecto antes de publicar. No garantiza trafico, rankings, indexacion ni resultados ",built_dist,PASS
B04,35,content-calendar-generator,fr,générateur de content calendar,generateur-content-calendar,https://taptogen.com/fr/tools/generateur-content-calendar/,Générateur de Content Calendar,Générateur de Content Calendar gratuit,"Créez des brouillons clairs en français et vérifiez chaque resultat avant usage. Verifiez exactitude, originalité, compatibilité et regles du projet avant publication. Aucun trafic, classement, indexation ni resultat de ",built_dist,PASS
B04,35,content-calendar-generator,de,generator für content calendar,generator-content-calendar,https://taptogen.com/de/tools/generator-content-calendar/,Generator für Content Calendar,Generator für Content Calendar kostenlos,"Erstelle klare Entwürfe auf Deutsch und prüfe jedes Ergebnis vor der Nutzung. Prüfe Genauigkeit, Originalitaet, Kompatibilität und Projektregeln vor der Veroeffentlichung. Traffic, Rankings, Indexierung oder Plattfor",built_dist,PASS
B04,35,content-calendar-generator,pt,gerador de content calendar,gerador-content-calendar,https://taptogen.com/pt/tools/gerador-content-calendar/,Gerador de Content Calendar,Gerador de Content Calendar gratis,"Crie rascunhos claros em português e revise cada resultado antes de usar. Revise precisao, originalidade, compatibilidade e regras do projeto antes de publicar. Nao ha garantia de trafego, rankings, indexacao ou resultad",built_dist,PASS
B04,35,content-calendar-generator,it,generatore di content calendar,generatore-content-calendar,https://taptogen.com/it/tools/generatore-content-calendar/,Generatore di Content Calendar,Generatore di Content Calendar gratis,"Crea bozze chiare in italiano e controlla ogni risultato prima di usarlo. Controlla accuratezza, originalità, compatibilità e regole del progetto prima della pubblicazione. Non garantisce traffico, ranking, indicizzazion",built_dist,PASS
B04,35,content-calendar-generator,pl,generator content calendar,generator-content-calendar,https://taptogen.com/pl/tools/generator-content-calendar/,Generator Content Calendar,Generator Content Calendar za darmo,"Twórz jasne wersje robocze po polsku i sprawdźaj wynik przed użyciem. Sprawdź dokładność, oryginalność, zgodność i zasady projektu przed publikacją. Nie gwarantuje ruchu, pozycji, indeksowania ani wynikow platformy.",built_dist,PASS
B04,35,content-calendar-generator,ru,generator content calendar,generator-content-calendar,https://taptogen.com/ru/tools/generator-content-calendar/,Generator Content Calendar,Generator Content Calendar besplatno,"Sozdavaite ponyatnye chernoviki na russkom i proveriaite rezultat pered ispolzovaniem. Proverte tochnost, originalnost, sovmestimost i pravila proekta pered publikatsiei. Trafik, pozitsii, indeksatsiya i rezultaty platfo",built_dist,PASS
B04,35,content-calendar-generator,tr,olusturucu content calendar,olusturucu-content-calendar,https://taptogen.com/tr/tools/olusturucu-content-calendar/,Olusturucu Content Calendar,Olusturucu Content Calendar ucretsiz,"Turkce net taslaklar olusturun ve kullanmadan once sonucu kontrol edin. Yayinlamadan once dogruluk, ozgunluk, uyumluluk ve proje kurallarini kontrol edin. Trafik, siralama, indeksleme veya platform sonucu garanti edilmez",built_dist,PASS
B04,35,content-calendar-generator,id,generator content calendar,generator-content-calendar,https://taptogen.com/id/tools/generator-content-calendar/,Generator Content Calendar,Generator Content Calendar gratis,"Buat draf yang jelas dalam bahasa Indonesia dan tinjau hasil sebelum digunakan. Periksa akurasi, orisinalitas, kompatibilitas, dan aturan proyek sebelum menerbitkan. Tidak menjamin trafik, peringkat, pengindeksan, atau h",built_dist,PASS
B04,35,content-calendar-generator,sv,generator for content calendar,generator-content-calendar,https://taptogen.com/sv/tools/generator-content-calendar/,Generator for Content Calendar,Generator for Content Calendar gratis,"Skapa tydliga utkast pa svenska och granska resultatet innan du anvander det. Kontrollera noggrannhet, originalitet, kompatibilitet och projektregler fore publicering. Trafik, rankning, indexering eller plattformsresulta",built_dist,PASS
