"word-counter","de","wortzaehler","wortzaehler","Wortzaehler","Wortzaehler online kostenlos","Zaehle Woerter, Zeichen und Textlaenge fuer Artikel, Aufgaben oder Beitraege.","Fuege Text ein und erhalte schnelle Zaehlungen, ohne den Inhalt zu veraendern.","woerter zaehlen; zeichenzahler; textlaenge","/de/tools/wortzaehler/","German head term is Wortzaehler; slug ASCII-normalized.","Low risk; avoid storing sensitive text."
"paragraph-generator","es","generador de parrafos","generador-de-parrafos","Generador de parrafos","Generador de parrafos gratis","Crea borradores de parrafos para ideas, articulos, descripciones o ejercicios de escritura.","Genera texto inicial y revisa hechos, tono y originalidad antes de publicarlo.","parrafos para textos; escribir parrafo; ideas de parrafos","/es/tools/generador-de-parrafos/","Direct writing-assist intent.","Review factual claims and avoid submitting unedited work."
"paragraph-generator","fr","generateur de paragraphes","generateur-de-paragraphes","Generateur de paragraphes","Generateur de paragraphes gratuit","Creez des brouillons de paragraphes pour idees, articles, descriptions ou exercices.","Generez une base de texte puis relisez faits, ton et originalite.","ecrire un paragraphe; paragraphe exemple; idees paragraphes","/fr/tools/generateur-de-paragraphes/","Direct French writing generator intent.","Review factual claims and avoid submitting unedited work."
"paragraph-generator","de","absatz generator","absatz-generator","Absatz Generator","Absatz Generator kostenlos","Erstelle Absatz-Entwuerfe fuer Ideen, Artikel, Beschreibungen und Schreibuebungen.","Nutze den Text als Grundlage und pruefe Fakten, Ton und Originalitaet.","absatz schreiben; textabschnitt; absatz beispiel","/de/tools/absatz-generator/","German writing query uses Absatz Generator.","Review factual claims and avoid submitting unedited work."
"sentence-generator","es","generador de oraciones","generador-de-oraciones","Generador de oraciones","Generador de oraciones gratis","Crea oraciones de ejemplo para escritura, practica, contenido o lluvia de ideas.","Genera frases base y ajusta gramatica, contexto y precision antes de usarlas.","oraciones de ejemplo; crear frases; frases para escribir","/es/tools/generador-de-oraciones/","Spanish oraciones is better for sentence tool than frases in some contexts.","Review grammar and factual context."
"sentence-generator","fr","generateur de phrases","generateur-de-phrases","Generateur de phrases","Generateur de phrases gratuit","Creez des phrases d'exemple pour ecriture, apprentissage, contenu ou ideation.","Generez des phrases puis adaptez grammaire, contexte et precision.","phrases exemple; creer une phrase; idees de phrases","/fr/tools/generateur-de-phrases/","Direct French sentence generation intent.","Review grammar and factual context."
"sentence-generator","de","satz generator","satz-generator","Satz Generator","Satz Generator kostenlos","Erstelle Beispielsatze fuer Schreiben, Lernen, Content und Ideenfindung.","Passe Grammatik, Kontext und Genauigkeit an, bevor du Saetze verwendest.","beispielsaetze; satz schreiben; saetze generieren","/de/tools/satz-generator/","German direct term Satz Generator.","Review grammar and factual context."
"writing-prompt-generator","es","ideas para escribir","ideas-para-escribir","Generador de ideas para escribir","Ideas para escribir gratis","Encuentra prompts e ideas para cuentos, escenas, diarios o ejercicios creativos.","Genera disparadores de escritura y adaptalos a tu voz, genero y objetivo.","prompts de escritura; ideas para cuentos; ejercicios creativos","/es/tools/ideas-para-escribir/","Spanish local intent favors writing ideas over prompt literal.","Avoid school dishonesty framing; creative support only."
"writing-prompt-generator","fr","generateur d'idees d'ecriture","generateur-didees-decriture","Generateur d'idees d'ecriture","Idees d'ecriture gratuites","Trouvez des idees et prompts pour histoires, scenes, journaux ou exercices creatifs.","Generez un point de depart puis adaptez-le a votre voix et a votre genre.","prompts ecriture; idees histoire; exercice ecriture","/fr/tools/generateur-didees-decriture/","French phrase captures prompt intent naturally.","Avoid academic dishonesty framing."
"writing-prompt-generator","de","schreibimpulse generator","schreibimpulse-generator","Schreibimpulse Generator","Schreibimpulse Generator kostenlos","Finde Schreibimpulse fuer Geschichten, Szenen, Journale und kreative Uebungen.","Nutze die Ideen als Startpunkt und entwickle sie mit eigener Stimme weiter.","schreibideen; writing prompts; geschichten ideen","/de/tools/schreibimpulse-generator/","German native term Schreibimpulse matches creative prompt intent.","Avoid academic dishonesty framing."
"blog-outline-generator","es","esquema para blog","esquema-para-blog","Generador de esquema para blog","Esquema para blog gratis","Crea estructuras de articulos con secciones, subtitulos e ideas principales.","Genera un esquema inicial y ajustalo segun intencion de busqueda y experiencia real.","estructura de blog; outline de articulo; plan de contenido","/es/tools/esquema-para-blog/","Spanish intent is outline/structure for blog posts.","Avoid thin SEO content; require human expertise."
"blog-outline-generator","fr","generateur de plan d'article","generateur-de-plan-darticle","Generateur de plan d'article","Generateur de plan d'article gratuit","Creez un plan d'article avec sections, sous-titres et idees principales.","Generez une structure puis adaptez-la a l'intention de recherche et a votre expertise.","plan article blog; structure article; outline blog","/fr/tools/generateur-de-plan-darticle/","French users search plan d'article more than blog outline.","Avoid thin SEO content; require human expertise."
"blog-outline-generator","de","blog gliederung generator","blog-gliederung-generator","Blog Gliederung Generator","Blog Gliederung Generator kostenlos","Erstelle Gliederungen fuer Blogartikel mit Abschnitten, Ueberschriften und Kernideen.","Passe die Struktur an Suchintention, Erfahrung und echte Inhalte an.","blog outline; artikel gliederung; content plan","/de/tools/blog-gliederung-generator/","German Gliederung is better local intent than literal outline alone.","Avoid thin SEO content; require human expertise."
"product-description-generator","es","generador de descripciones de productos","generador-de-descripciones-de-productos","Generador de descripciones de productos","Generador de descripciones de productos gratis","Crea borradores de descripciones para productos, tiendas y fichas comerciales.","Genera texto de producto y revisa exactitud, beneficios, politicas y cumplimiento.","descripcion de producto; ficha de producto; copy ecommerce","/es/tools/generador-de-descripciones-de-productos/","Direct ecommerce copy intent.","Must verify factual claims, pricing, compliance, and policies."
"product-description-generator","fr","generateur de description produit","generateur-de-description-produit","Generateur de description produit","Generateur de description produit gratuit","Redigez des brouillons de descriptions pour produits, boutiques et fiches e-commerce.","Generez une base puis verifiez faits, avantages, politiques et conformite.","description produit; fiche produit; texte ecommerce","/fr/tools/generateur-de-description-produit/","Direct French ecommerce copy intent.","Must verify factual claims, pricing, compliance, and policies."
"product-description-generator","de","produktbeschreibung generator","produktbeschreibung-generator","Produktbeschreibung Generator","Produktbeschreibung Generator kostenlos","Erstelle Entwuerfe fuer Produktbeschreibungen, Shops und Verkaufsseiten.","Pruefe Fakten, Vorteile, Richtlinien und rechtliche Aussagen vor Veroeffentlichung.","produktbeschreibung schreiben; shop text; ecommerce copy","/de/tools/produktbeschreibung-generator/","Natural German compound for ecommerce copy.","Must verify factual claims, pricing, compliance, and policies."
