"podcast-name-generator","de","podcastnamen generator","podcastnamen-generator","Podcastnamen Generator","Podcastnamen Generator kostenlos","Erstelle Namensideen fuer Podcasts, Audioformate und Episodenserien.","Pruefe die Vorschlaege in Verzeichnissen, Domains und Markenrecherche.","podcast name finden; podcast ideen; podcast titel","/de/tools/podcastnamen-generator/","Natural German compound.","Avoid platform availability guarantees."
"youtube-tag-generator","es","generador de etiquetas para videos","generador-de-etiquetas-para-videos","Generador de etiquetas para videos","Generador de etiquetas para videos gratis","Crea ideas de etiquetas para organizar y describir videos sin prometer posicionamiento.","Genera tags relacionados con el tema del video y revisa relevancia antes de publicar.","etiquetas para videos; tags de video; ideas de tags","/es/tools/generador-de-etiquetas-para-videos/","Avoids brand dependency while preserving video-tag intent.","Do not promise rankings or use platform-brand claims."
"youtube-tag-generator","fr","generateur de tags video","generateur-de-tags-video","Generateur de tags video","Generateur de tags video gratuit","Creez des idees de tags pour decrire et organiser des videos en ligne.","Choisissez des tags pertinents pour le sujet sans garantie de classement ou de vues.","tags video; mots cles video; idees de tags","/fr/tools/generateur-de-tags-video/","French users use tags video; brand-neutral and same intent.","Do not promise rankings or use platform-brand claims."
"youtube-tag-generator","de","video tags generator","video-tags-generator","Video Tags Generator","Video Tags Generator kostenlos","Erstelle Tag-Ideen fuer Online-Videos, Beschreibungen und Themencluster.","Waehle relevante Tags passend zum Inhalt ohne Ranking- oder Reichweitenversprechen.","video tags; tags fuer videos; keyword ideen video","/de/tools/video-tags-generator/","German SERP intent often mixes English for video tags.","No ranking guarantees or platform-brand claims."
"hashtag-generator","es","generador de hashtags","generador-de-hashtags","Generador de hashtags","Generador de hashtags gratis","Crea hashtags relacionados con un tema, campana, publicacion o idea de contenido.","Genera etiquetas sociales relevantes y revisa tono, significado y contexto actual.","hashtags para redes; hashtags populares; ideas de hashtags","/es/tools/generador-de-hashtags/","Direct social hashtag intent.","Avoid promising virality or trending accuracy."
"hashtag-generator","fr","generateur de hashtags","generateur-de-hashtags","Generateur de hashtags","Generateur de hashtags gratuit","Creez des hashtags pertinents pour publications, campagnes et idees de contenu.","Generez des suggestions puis verifiez contexte, ton et actualite avant publication.","hashtags reseaux sociaux; hashtags populaires; idees hashtags","/fr/tools/generateur-de-hashtags/","Direct French social intent.","Avoid promising virality or trend accuracy."
"hashtag-generator","de","hashtag generator","hashtag-generator","Hashtag Generator","Hashtag Generator kostenlos","Erstelle Hashtag-Ideen fuer Beitraege, Kampagnen und Content-Themen.","Pruefe Bedeutung, Ton und Aktualitaet, bevor du Hashtags veroeffentlichst.","hashtags finden; social media hashtags; hashtag ideen","/de/tools/hashtag-generator/","German commonly uses English loanword.","Avoid promising virality or trend accuracy."
"keyword-generator","es","generador de palabras clave","generador-de-palabras-clave","Generador de palabras clave","Generador de palabras clave gratis","Encuentra ideas de palabras clave para contenido, SEO, anuncios o investigacion inicial.","Genera temas y terminos relacionados, luego valida volumen, competencia e intencion.","palabras clave SEO; ideas de keywords; investigacion keyword","/es/tools/generador-de-palabras-clave/","Direct SEO keyword ideation intent.","No traffic, ranking, or ad-performance guarantees."
"keyword-generator","fr","generateur de mots cles","generateur-de-mots-cles","Generateur de mots cles","Generateur de mots cles gratuit","Trouvez des idees de mots cles pour contenu, SEO, annonces ou recherche initiale.","Generez des pistes puis validez volume, concurrence et intention de recherche.","mots cles SEO; idees keywords; recherche de mots cles","/fr/tools/generateur-de-mots-cles/","Direct French SEO intent.","No ranking or ad-performance guarantees."
"keyword-generator","de","keyword generator","keyword-generator","Keyword Generator","Keyword Generator kostenlos","Finde Keyword-Ideen fuer Content, SEO, Anzeigen und erste Themenrecherche.","Nutze die Vorschlaege als Startpunkt und pruefe Suchvolumen, Wettbewerb und Intent.","seo keywords; keyword ideen; keyword recherche","/de/tools/keyword-generator/","German SEO searches commonly use Keyword Generator.","No ranking or ad-performance guarantees."
"meta-tag-generator","es","generador de meta tags","generador-de-meta-tags","Generador de meta tags","Generador de meta tags gratis","Crea borradores de meta tags para paginas web, SEO tecnico y vistas previas sociales.","Genera etiquetas base y revisa longitud, relevancia y compatibilidad antes de implementar.","meta tags SEO; etiquetas meta; meta title y description","/es/tools/generador-de-meta-tags/","Spanish SEO users often use meta tags loan term.","Technical output should be reviewed before production."
"meta-tag-generator","fr","generateur de balises meta","generateur-de-balises-meta","Generateur de balises meta","Generateur de balises meta gratuit","Creez des brouillons de balises meta pour pages web, SEO et apercus sociaux.","Generez une base puis controlez longueur, pertinence et integration technique.","balises meta SEO; meta title; meta description","/fr/tools/generateur-de-balises-meta/","French native balises meta is high-intent.","Technical output should be reviewed before production."
"meta-tag-generator","de","meta tag generator","meta-tag-generator","Meta Tag Generator","Meta Tag Generator kostenlos","Erstelle Meta-Tag-Entwuerfe fuer Webseiten, SEO und Social Previews.","Pruefe Laenge, Relevanz und technische Einbindung, bevor du Tags einsetzt.","meta tags seo; meta title; meta description","/de/tools/meta-tag-generator/","German SEO searches commonly keep Meta Tag.","Technical output should be reviewed before production."
"meta-description-generator","es","generador de meta descripciones","generador-de-meta-descripciones","Generador de meta descripciones","Generador de meta descripciones gratis","Crea meta descripciones para paginas, articulos y fichas con enfoque claro de clic.","Genera borradores breves y ajusta longitud, precision y promesa antes de publicar.","meta descripcion SEO; description para Google; snippet SEO","/es/tools/generador-de-meta-descripciones/","Direct SEO snippet-writing intent.","No CTR or ranking guarantees."
"meta-description-generator","fr","generateur de meta description","generateur-de-meta-description","Generateur de meta description","Generateur de meta description gratuit","Redigez des brouillons de meta descriptions pour pages, articles et fiches produit.","Generez un texte court puis ajustez longueur, precision et promesse de clic.","meta description SEO; snippet Google; description page","/fr/tools/generateur-de-meta-description/","French SEO commonly uses singular meta description.","No CTR or ranking guarantees."
"meta-description-generator","de","meta beschreibung generator","meta-beschreibung-generator","Meta Beschreibung Generator","Meta Beschreibung Generator kostenlos","Erstelle Meta-Beschreibungen fuer Seiten, Artikel und Produkttexte.","Optimiere Laenge, Relevanz und Klickversprechen ohne Ranking-Garantie.","meta description; seo beschreibung; snippet text","/de/tools/meta-beschreibung-generator/","German hybrid/native term is clear.","No CTR or ranking guarantees."
"seo-title-generator","es","generador de titulos SEO","generador-de-titulos-seo","Generador de titulos SEO","Generador de titulos SEO gratis","Crea ideas de titulos SEO para paginas, articulos, guias y fichas de producto.","Genera opciones de titulo y revisa longitud, intencion y exactitud antes de usarlas.","titulo SEO; title tag; titulos para Google","/es/tools/generador-de-titulos-seo/","Direct SEO title intent.","No ranking guarantees; avoid misleading clickbait."
"seo-title-generator","fr","generateur de titre SEO","generateur-de-titre-seo","Generateur de titre SEO","Generateur de titre SEO gratuit","Creez des idees de titres SEO pour pages, articles, guides et fiches produit.","Generez plusieurs titres puis verifiez longueur, intention et exactitude.","titre SEO; balise title; titre Google","/fr/tools/generateur-de-titre-seo/","Direct French SEO title intent.","No ranking guarantees; avoid misleading clickbait."
"seo-title-generator","de","seo titel generator","seo-titel-generator","SEO Titel Generator","SEO Titel Generator kostenlos","Erstelle SEO-Titel fuer Seiten, Artikel, Ratgeber und Produkttexte.","Pruefe Laenge, Suchintention und Genauigkeit, bevor du den Title verwendest.","seo title; title tag; google titel","/de/tools/seo-titel-generator/","Natural German SEO hybrid.","No ranking guarantees; avoid misleading clickbait."
"faq-generator","es","generador de preguntas frecuentes","generador-de-preguntas-frecuentes","Generador de preguntas frecuentes","Generador de preguntas frecuentes gratis","Crea ideas de preguntas frecuentes para paginas, productos, servicios o articulos.","Genera temas de FAQ utiles y revisa exactitud, politicas y respuesta final.","preguntas frecuentes; FAQ para web; preguntas y respuestas","/es/tools/generador-de-preguntas-frecuentes/","Spanish expands FAQ for broader local clarity.","Review answers for factual and policy accuracy."
"faq-generator","fr","generateur de FAQ","generateur-de-faq","Generateur de FAQ","Generateur de FAQ gratuit","Creez des idees de questions frequentes pour pages, produits, services ou articles.","Generez une structure de FAQ puis verifiez les reponses et les limites du sujet.","questions frequentes; FAQ site web; questions reponses","/fr/tools/generateur-de-faq/","French commonly uses FAQ in digital content.","Review answers for factual and policy accuracy."
"faq-generator","de","faq generator","faq-generator","FAQ Generator","FAQ Generator kostenlos","Erstelle FAQ-Ideen fuer Webseiten, Produkte, Services und Artikel.","Nutze die Fragen als Entwurf und pruefe Antworten, Fakten und rechtliche Aussagen.","haeufige fragen; faq erstellen; fragen und antworten","/de/tools/faq-generator/","German SERP uses FAQ Generator strongly.","Review answers for factual and policy accuracy."
"canonical-tag-generator","es","generador de etiqueta canonical","generador-de-etiqueta-canonical","Generador de etiqueta canonical","Generador de etiqueta canonical gratis","Crea borradores de etiquetas canonical para indicar la URL preferida de una pagina.","Genera el formato base y revisa la URL final antes de implementarlo en tu sitio.","canonical SEO; etiqueta canonica; URL canonica","/es/tools/generador-de-etiqueta-canonical/","SEO technical query; canonical often remains English.","Technical SEO review required."
"canonical-tag-generator","fr","generateur de balise canonique","generateur-de-balise-canonique","Generateur de balise canonique","Generateur de balise canonique gratuit","Creez une balise canonique pour signaler l'URL preferee d'une page.","Generez un brouillon puis verifiez l'URL, le protocole et l'integration HTML.","balise canonical; URL canonique; SEO technique","/fr/tools/generateur-de-balise-canonique/","French uses balise canonique/canonical; native phrase is clear.","Technical SEO review required."
"canonical-tag-generator","de","canonical tag generator","canonical-tag-generator","Canonical Tag Generator","Canonical Tag Generator kostenlos","Erstelle Canonical-Tag-Entwuerfe fuer die bevorzugte URL einer Seite.","Pruefe URL, Protokoll und HTML-Einbindung vor dem Einsatz.","canonical tag; kanonische URL; technisches SEO","/de/tools/canonical-tag-generator/","German SEO often uses Canonical Tag in English.","Technical SEO review required."
"robots-txt-generator","es","generador de robots.txt","generador-de-robots-txt","Generador de robots.txt","Generador de robots.txt gratis","Crea borradores de archivos robots.txt para reglas basicas de rastreo.","Genera reglas iniciales y revisa que no bloqueen paginas importantes por error.","robots.txt SEO; archivo robots; reglas de rastreo","/es/tools/generador-de-robots-txt/","Technical query is language-neutral around robots.txt.","High risk if misused; require manual SEO review."
"robots-txt-generator","fr","generateur robots.txt","generateur-robots-txt","Generateur robots.txt","Generateur robots.txt gratuit","Creez un brouillon de fichier robots.txt pour des regles de crawl simples.","Controlez chaque directive afin de ne pas bloquer des pages importantes.","robots.txt SEO; fichier robots; directives crawl","/fr/tools/generateur-robots-txt/","French users search with robots.txt unchanged.","High risk if misused; require manual SEO review."
"robots-txt-generator","de","robots.txt generator","robots-txt-generator","robots.txt Generator","robots.txt Generator kostenlos","Erstelle robots.txt-Entwuerfe fuer einfache Crawling-Regeln.","Pruefe jede Direktive sorgfaeltig, damit wichtige Seiten nicht blockiert werden.","robots.txt seo; crawling regeln; robots datei","/de/tools/robots-txt-generator/","German query keeps robots.txt term.","High risk if misused; require manual SEO review."
"open-graph-generator","es","generador de etiquetas Open Graph","generador-de-etiquetas-open-graph","Generador de etiquetas Open Graph","Generador de etiquetas Open Graph gratis","Crea borradores de etiquetas Open Graph para vistas previas al compartir enlaces.","Genera titulo, descripcion e imagen sugerida y revisa cada campo antes de publicar.","Open Graph SEO; etiquetas sociales; vista previa enlace","/es/tools/generador-de-etiquetas-open-graph/","Protocol name is standard; intent is social preview metadata.","Review image rights and avoid misleading previews."
"open-graph-generator","fr","generateur Open Graph","generateur-open-graph","Generateur Open Graph","Generateur Open Graph gratuit","Creez des balises Open Graph pour ameliorer les apercus de liens partages.","Generez les champs principaux puis verifiez titre, description, image et URL.","Open Graph; balises sociales; apercu lien","/fr/tools/generateur-open-graph/","French technical searches keep Open Graph.","Review image rights and avoid misleading previews."
"open-graph-generator","de","open graph generator","open-graph-generator","Open Graph Generator","Open Graph Generator kostenlos","Erstelle Open-Graph-Tags fuer Link-Vorschauen in sozialen und Messaging-Kontexten.","Pruefe Titel, Beschreibung, Bildrechte und URL, bevor du die Tags einsetzt.","open graph tags; social preview; og tags","/de/tools/open-graph-generator/","German technical query keeps Open Graph.","Review image rights and avoid misleading previews."
"fancy-text-generator","es","letras bonitas","letras-bonitas","Generador de letras bonitas","Letras bonitas para copiar","Convierte texto en estilos decorativos para perfiles, mensajes y publicaciones.","Crea texto estilizado y comprueba legibilidad y compatibilidad antes de compartir.","letras para copiar; texto bonito; fuentes decorativas","/es/tools/letras-bonitas/","Spanish search intent strongly favors letras bonitas over literal fancy text.","Avoid deceptive identity or accessibility issues."
"fancy-text-generator","fr","generateur de texte stylise","generateur-de-texte-stylise","Generateur de texte stylise","Generateur de texte stylise gratuit","Transformez du texte en styles decoratifs a copier pour profils et messages.","Generez du texte stylise puis verifiez lisibilite et compatibilite selon la plateforme.","texte stylise; police a copier; lettres decoratives","/fr/tools/generateur-de-texte-stylise/","French prefers texte stylise/police a copier.","Accessibility and compatibility caveat needed."
"fancy-text-generator","de","schriftgenerator","schriftgenerator","Schriftgenerator","Schriftgenerator kostenlos","Wandle Text in dekorative Schriftstile zum Kopieren fuer Profile und Nachrichten um.","Erstelle stylischen Text und pruefe Lesbarkeit sowie Plattform-Kompatibilitaet.","schrift zum kopieren; schoene schrift; fancy text","/de/tools/schriftgenerator/","German head term is Schriftgenerator.","Accessibility and compatibility caveat needed."
"bold-text-generator","es","texto en negrita","texto-en-negrita","Generador de texto en negrita","Texto en negrita para copiar","Convierte texto normal en estilos de negrita para copiar y pegar.","Genera texto destacado y revisa que sea legible en la app o pagina donde lo uses.","negrita unicode; letras en negrita; copiar texto negrita","/es/tools/texto-en-negrita/","Spanish users search copyable bold text, not only generator.","Compatibility/accessibility warning."
"bold-text-generator","fr","texte gras","texte-gras","Generateur de texte gras","Texte gras a copier","Transformez du texte en style gras a copier pour profils, messages et titres.","Creez du texte en gras puis verifiez lisibilite et compatibilite d'affichage.","texte en gras; lettres grasses; gras unicode","/fr/tools/texte-gras/","French intent is copyable bold text.","Compatibility/accessibility warning."
"bold-text-generator","de","fettschrift generator","fettschrift-generator","Fettschrift Generator","Fettschrift Generator kostenlos","Wandle Text in fette Unicode-Schrift zum Kopieren und Einfuegen um.","Pruefe vor der Nutzung, ob der Text lesbar und kompatibel bleibt.","fetter text; bold text kopieren; unicode fettschrift","/de/tools/fettschrift-generator/","German native term Fettschrift is strong.","Compatibility/accessibility warning."
"cursive-text-generator","es","letras cursivas","letras-cursivas","Generador de letras cursivas","Letras cursivas para copiar","Convierte texto en estilos cursivos decorativos para copiar en perfiles y mensajes.","Genera letras cursivas y verifica legibilidad, acentos y compatibilidad antes de publicar.","cursiva para copiar; texto cursivo; letras manuscritas","/es/tools/letras-cursivas/","Spanish users search letras cursivas para copiar.","Compatibility/accessibility warning."
"cursive-text-generator","fr","texte cursif","texte-cursif","Generateur de texte cursif","Texte cursif a copier","Transformez du texte en style cursif decoratif pour profils, messages et bios.","Generez une version cursive puis controlez lisibilite et compatibilite.","ecriture cursive; cursif a copier; lettres manuscrites","/fr/tools/texte-cursif/","French copyable cursive text intent.","Compatibility/accessibility warning."
"cursive-text-generator","de","kursivschrift generator","kursivschrift-generator","Kursivschrift Generator","Kursivschrift Generator kostenlos","Erstelle dekorative Kursivschrift zum Kopieren fuer Profile und Nachrichten.","Pruefe Lesbarkeit und Kompatibilitaet, besonders bei Umlauten und Sonderzeichen.","kursivschrift kopieren; cursive text; schrift kursiv","/de/tools/kursivschrift-generator/","German term Kursivschrift fits cursive-style query.","Compatibility/accessibility warning."
"italic-text-generator","es","texto italica","texto-italica","Generador de texto italica","Texto italica para copiar","Convierte texto en estilo italica o inclinado para copiar y pegar.","Crea texto inclinado y revisa si la plataforma lo muestra correctamente.","italica unicode; texto inclinado; cursiva para copiar","/es/tools/texto-italica/","Spanish often blends italica/cursiva; chosen slug avoids collision with cursive tool.","Compatibility/accessibility warning."
"italic-text-generator","fr","texte italique","texte-italique","Generateur de texte italique","Texte italique a copier","Transformez du texte en italique a copier pour messages, profils et titres courts.","Generez une version italique puis verifiez affichage et lisibilite.","italique unicode; texte penche; italique a copier","/fr/tools/texte-italique/","French distinguishes italique from cursif.","Compatibility/accessibility warning."
"italic-text-generator","de","kursiver text generator","kursiver-text-generator","Kursiver Text Generator","Kursiver Text Generator kostenlos","Wandle normalen Text in kursiven Unicode-Text zum Kopieren um.","Teste die Darstellung vor der Nutzung, da nicht jede Plattform alle Zeichen unterstuetzt.","kursiver text kopieren; italic text; text schraeg","/de/tools/kursiver-text-generator/","Distinct from Kursivschrift slug to avoid collision with cursive tool.","Compatibility/accessibility warning."
"small-text-generator","es","letras pequenas","letras-pequenas","Generador de letras pequenas","Letras pequenas para copiar","Convierte texto en caracteres pequenos decorativos para copiar y pegar.","Genera texto pequeno y comprueba legibilidad, accesibilidad y compatibilidad.","texto pequeno; letras mini; small text copiar","/es/tools/letras-pequenas/","Spanish local copy intent is letras pequenas/texto pequeno.","Accessibility and readability risk."
"small-text-generator","fr","petit texte","petit-texte","Generateur de petit texte","Petit texte a copier","Transformez du texte en petits caracteres decoratifs a copier.","Utilisez le petit texte avec moderation et verifiez lisibilite sur mobile.","petites lettres; small text; texte miniature","/fr/tools/petit-texte/","French query favors petit texte/petites lettres.","Accessibility and readability risk."
"small-text-generator","de","kleiner text generator","kleiner-text-generator","Kleiner Text Generator","Kleiner Text Generator kostenlos","Erstelle kleinen Unicode-Text zum Kopieren fuer Profile und Nachrichten.","Pruefe Lesbarkeit, Barrierefreiheit und Plattform-Kompatibilitaet.","kleine schrift; small text; mini text kopieren","/de/tools/kleiner-text-generator/","German native phrase is clear.","Accessibility and readability risk."
"reverse-text-generator","es","invertir texto","invertir-texto","Invertir texto","Invertir texto online gratis","Invierte letras o texto completo para juegos, formatos creativos o pruebas rapidas.","Pega tu texto, genera la version invertida y revisa que el resultado siga siendo correcto.","texto al reves; invertir palabras; escribir al reves","/es/tools/invertir-texto/","Spanish task query is stronger than generator wording.","Low risk; caution with sensitive text pasted into tools."
"reverse-text-generator","fr","inverser texte","inverser-texte","Inverser un texte","Inverser un texte en ligne","Inversez un texte ou des caracteres pour tests, jeux de mots ou effets creatifs.","Collez votre texte, obtenez la version inversee et relisez le resultat avant usage.","texte a l'envers; inverser mots; ecrire a l'envers","/fr/tools/inverser-texte/","French task verb better captures intent.","Low risk; caution with sensitive text."
"reverse-text-generator","de","text umdrehen","text-umdrehen","Text umdrehen","Text umdrehen online","Drehe Text oder Zeichenfolgen fuer Tests, Spiele und kreative Effekte um.","Fuege Text ein, erzeuge die umgekehrte Version und pruefe das Ergebnis.","text rueckwaerts; woerter umdrehen; spiegeltext","/de/tools/text-umdrehen/","German users search task phrase Text umdrehen.","Low risk; caution with sensitive text."
"text-case-converter","es","convertidor de mayusculas y minusculas","convertidor-de-mayusculas-y-minusculas","Convertidor de mayusculas y minusculas","Convertidor de mayusculas y minusculas gratis","Cambia texto entre mayusculas, minusculas, titulo y otros formatos comunes.","Pega texto y conviertelo al formato de capitalizacion que necesites.","pasar a mayusculas; convertir minusculas; capitalizar texto","/es/tools/convertidor-de-mayusculas-y-minusculas/","Direct utility intent in Spanish.","Low risk; caution with sensitive text."
"text-case-converter","fr","convertisseur majuscules minuscules","convertisseur-majuscules-minuscules","Convertisseur majuscules minuscules","Convertisseur majuscules minuscules gratuit","Convertissez du texte en majuscules, minuscules, casse titre ou formats similaires.","Collez le texte et choisissez la casse adaptee a votre document ou contenu.","mettre en majuscules; minuscules; changer la casse","/fr/tools/convertisseur-majuscules-minuscules/","French local task query uses majuscules/minuscules.","Low risk; caution with sensitive text."
"text-case-converter","de","gross kleinschreibung umwandeln","gross-kleinschreibung-umwandeln","Gross Kleinschreibung umwandeln","Gross Kleinschreibung online umwandeln","Wandle Text in Grossbuchstaben, Kleinbuchstaben, Titelschreibweise und weitere Formate um.","Fuege Text ein und waehle die passende Schreibweise fuer deinen Inhalt.","text in grossbuchstaben; kleinbuchstaben; text formatieren","/de/tools/gross-kleinschreibung-umwandeln/","German task phrase is more natural than converter loanword.","Low risk; caution with sensitive text."
"word-counter","es","contador de palabras","contador-de-palabras","Contador de palabras","Contador de palabras online gratis","Cuenta palabras, caracteres y longitud de texto para articulos, tareas o publicaciones.","Pega tu texto y revisa conteos utiles sin cambiar el contenido original.","contar palabras; contador de caracteres; longitud de texto","/es/tools/contador-de-palabras/","Direct high-volume utility intent.","Low risk; avoid storing sensitive text."
"word-counter","fr","compteur de mots","compteur-de-mots","Compteur de mots","Compteur de mots en ligne gratuit","Comptez les mots, caracteres et longueurs de texte pour articles, devoirs ou posts.","Collez votre texte et obtenez des compteurs utiles sans modifier le contenu.","compter les mots; compteur caracteres; longueur texte","/fr/tools/compteur-de-mots/","Direct French utility intent.","Low risk; avoid storing sensitive text."
