batchId,toolOrder,canonicalToolId,language,primaryKeyword,localizedSlug,localizedUrl,h1,metaTitle,metaDescription,source,status
B04,19,lowercase-generator,ar,مولد lowercase,muwallid-lowercase,https://taptogen.com/ar/tools/muwallid-lowercase/,مولد Lowercase,مولد Lowercase مجانا,أنشئ مسودات عربية واضحة وراجع كل نتيجة قبل استخدامها. راجع الدقة والأصالة والتوافق وقواعد المشروع قبل النشر. Tahaqqaq min suhulat alqiraah waimkaniyat alwusul watawafuq almanassah qabla musharakat alnass almuzakhraf.,built_dist,PASS
B04,20,corporate-speak-generator,es,generador de corporate speak,generador-corporate-speak,https://taptogen.com/es/tools/generador-corporate-speak/,Generador de Corporate Speak,Generador de Corporate Speak gratis,"Crea borradores claros en español y revisa cada resultado antes de usarlo. Revisa exactitud, originalidad, compatibilidad y reglas del proyecto antes de publicar. Mantenlo como juego o lluvia de ideas; evita identidad, d",built_dist,PASS
B04,20,corporate-speak-generator,fr,générateur de corporate speak,generateur-corporate-speak,https://taptogen.com/fr/tools/generateur-corporate-speak/,Générateur de Corporate Speak,Générateur de Corporate Speak gratuit,"Créez des brouillons clairs en français et vérifiez chaque resultat avant usage. Verifiez exactitude, originalité, compatibilité et regles du projet avant publication. Gardez un usage ludique ou idéation; evitez identite",built_dist,PASS
B04,20,corporate-speak-generator,de,generator für corporate speak,generator-corporate-speak,https://taptogen.com/de/tools/generator-corporate-speak/,Generator für Corporate Speak,Generator für Corporate Speak kostenlos,"Erstelle klare Entwürfe auf Deutsch und prüfe jedes Ergebnis vor der Nutzung. Prüfe Genauigkeit, Originalitaet, Kompatibilität und Projektregeln vor der Veroeffentlichung. Nutze es spielerisch oder zur Ideenfindung; ",built_dist,PASS
B04,20,corporate-speak-generator,pt,gerador de corporate speak,gerador-corporate-speak,https://taptogen.com/pt/tools/gerador-corporate-speak/,Gerador de Corporate Speak,Gerador de Corporate Speak gratis,"Crie rascunhos claros em português e revise cada resultado antes de usar. Revise precisao, originalidade, compatibilidade e regras do projeto antes de publicar. Mantenha como brincadeira ou ideacao; evite identidade, doc",built_dist,PASS
B04,20,corporate-speak-generator,it,generatore di corporate speak,generatore-corporate-speak,https://taptogen.com/it/tools/generatore-corporate-speak/,Generatore di Corporate Speak,Generatore di Corporate Speak gratis,"Crea bozze chiare in italiano e controlla ogni risultato prima di usarlo. Controlla accuratezza, originalità, compatibilità e regole del progetto prima della pubblicazione. Usalo per gioco o brainstorming; evita identità",built_dist,PASS
B04,20,corporate-speak-generator,pl,generator corporate speak,generator-corporate-speak,https://taptogen.com/pl/tools/generator-corporate-speak/,Generator Corporate Speak,Generator Corporate Speak za darmo,"Twórz jasne wersje robocze po polsku i sprawdźaj wynik przed użyciem. Sprawdź dokładność, oryginalność, zgodność i zasady projektu przed publikacją. Uzywaj do zabawy lub pomysłów; unikaj tozsamosci, dokumentow, nekania l",built_dist,PASS
B04,20,corporate-speak-generator,ru,generator corporate speak,generator-corporate-speak,https://taptogen.com/ru/tools/generator-corporate-speak/,Generator Corporate Speak,Generator Corporate Speak besplatno,"Sozdavaite ponyatnye chernoviki na russkom i proveriaite rezultat pered ispolzovaniem. Proverte tochnost, originalnost, sovmestimost i pravila proekta pered publikatsiei. Ispolzuyte dlya igry ili idei; izbegajte lichnost",built_dist,PASS
B04,20,corporate-speak-generator,tr,olusturucu corporate speak,olusturucu-corporate-speak,https://taptogen.com/tr/tools/olusturucu-corporate-speak/,Olusturucu Corporate Speak,Olusturucu Corporate Speak ucretsiz,"Turkce net taslaklar olusturun ve kullanmadan once sonucu kontrol edin. Yayinlamadan once dogruluk, ozgunluk, uyumluluk ve proje kurallarini kontrol edin. Oyun veya fikir uretimi icin kullanin; kimlik, belge, taciz veya ",built_dist,PASS
B04,20,corporate-speak-generator,id,generator corporate speak,generator-corporate-speak,https://taptogen.com/id/tools/generator-corporate-speak/,Generator Corporate Speak,Generator Corporate Speak gratis,"Buat draf yang jelas dalam bahasa Indonesia dan tinjau hasil sebelum digunakan. Periksa akurasi, orisinalitas, kompatibilitas, dan aturan proyek sebelum menerbitkan. Gunakan untuk bermain atau ide awal; hindari identitas",built_dist,PASS
B04,20,corporate-speak-generator,sv,generator for corporate speak,generator-corporate-speak,https://taptogen.com/sv/tools/generator-corporate-speak/,Generator for Corporate Speak,Generator for Corporate Speak gratis,"Skapa tydliga utkast pa svenska och granska resultatet innan du anvander det. Kontrollera noggrannhet, originalitet, kompatibilitet och projektregler fore publicering. Anvand for lek eller ideer; undvik identitet, dokume",built_dist,PASS
B04,20,corporate-speak-generator,ms,penjana corporate speak,penjana-corporate-speak,https://taptogen.com/ms/tools/penjana-corporate-speak/,Penjana Corporate Speak,Penjana Corporate Speak percuma,"Cipta draf jelas dalam Bahasa Melayu dan semak hasil sebelum digunakan. Semak ketepatan, keaslian, keserasian dan peraturan projek sebelum diterbitkan. Guna untuk bermain atau idea; elakkan identiti, dokumen, gangguan at",built_dist,PASS
B04,20,corporate-speak-generator,bg,generator za corporate speak,generator-corporate-speak,https://taptogen.com/bg/tools/generator-corporate-speak/,Generator za Corporate Speak,Generator za Corporate Speak bezplatno,"Sazdavaite yasni cherнови na balgarski i proveriavaite rezultata predi upotreba. Proverete tochnost, originalnost, savmestimost i pravilata na proekta predi publikuvane. Izpolzvaite za igra ili idei; izbqgvaite identichn",built_dist,PASS
B04,20,corporate-speak-generator,hi,corporate speak जनरेटर,generator-corporate-speak,https://taptogen.com/hi/tools/generator-corporate-speak/,Corporate Speak जनरेटर,Corporate Speak जनरेटर मुफ्त,"हिंदी में साफ ड्राफ्ट बनाएं और उपयोग से पहले हर परिणाम की समीक्षा करें. प्रकाशन से पहले सटीकता, मौलिकता, संगतता और प्रोजेक्ट नियम जांचें. Ise play ya brainstorming ke liye rakhein; identity, documents, harassment ya soci",built_dist,PASS
B04,20,corporate-speak-generator,bn,corporate speak জেনারেটর,generator-corporate-speak,https://taptogen.com/bn/tools/generator-corporate-speak/,Corporate Speak জেনারেটর,Corporate Speak জেনারেটর ফ্রি,"বাংলায় পরিষ্কার খসড়া তৈরি করুন এবং ব্যবহারের আগে ফলাফল পর্যালোচনা করুন. প্রকাশের আগে নির্ভুলতা, মৌলিকতা, সামঞ্জস্য এবং প্রকল্পের নিয়ম যাচাই করুন. Play ba brainstorming er jonno use korun; identity, documents, harassment ",built_dist,PASS
B04,20,corporate-speak-generator,ja,corporate speak ジェネレーター,generator-corporate-speak,https://taptogen.com/ja/tools/generator-corporate-speak/,Corporate Speak ジェネレーター,Corporate Speak ジェネレーター 無料,"日本語でわかりやすい下書きを作り、使う前に結果を確認します. 公開前に正確性、独自性、互換性、プロジェクト規則を確認してください. Play ya brainstorming ni todome, identity, documents, harassment, social pressure wo sakete kudasai.",built_dist,PASS
B04,20,corporate-speak-generator,ko,corporate speak 생성기,generator-corporate-speak,https://taptogen.com/ko/tools/generator-corporate-speak/,Corporate Speak 생성기,Corporate Speak 생성기 무료,"한국어로 명확한 초안을 만들고 사용 전에 결과를 검토하세요. 게시 전에 정확성, 독창성, 호환성, 프로젝트 규칙을 확인하세요. Play na brainstorming yongdo ro sayonghago identity, documents, harassment, social pressure reul pihaseyo.",built_dist,PASS
B04,20,corporate-speak-generator,ar,مولد corporate speak,muwallid-corporate-speak,https://taptogen.com/ar/tools/muwallid-corporate-speak/,مولد Corporate Speak,مولد Corporate Speak مجانا,أنشئ مسودات عربية واضحة وراجع كل نتيجة قبل استخدامها. راجع الدقة والأصالة والتوافق وقواعد المشروع قبل النشر. Istakhdimha liltarfih aw alafkar watajanab alhawiyah walwathaiq waliza aw aldaght alijtimaei.,built_dist,PASS
B04,21,random-word-generator,es,generador de random word,generador-random-word,https://taptogen.com/es/tools/generador-random-word/,Generador de Random Word,Generador de Random Word gratis,"Crea borradores claros en español y revisa cada resultado antes de usarlo. Revisa exactitud, originalidad, compatibilidad y reglas del proyecto antes de publicar. Mantenlo como juego o lluvia de ideas; evita identidad, d",built_dist,PASS
B04,21,random-word-generator,fr,générateur de random word,generateur-random-word,https://taptogen.com/fr/tools/generateur-random-word/,Générateur de Random Word,Générateur de Random Word gratuit,"Créez des brouillons clairs en français et vérifiez chaque resultat avant usage. Verifiez exactitude, originalité, compatibilité et regles du projet avant publication. Gardez un usage ludique ou idéation; evitez identite",built_dist,PASS
B04,21,random-word-generator,de,generator für random word,generator-random-word,https://taptogen.com/de/tools/generator-random-word/,Generator für Random Word,Generator für Random Word kostenlos,"Erstelle klare Entwürfe auf Deutsch und prüfe jedes Ergebnis vor der Nutzung. Prüfe Genauigkeit, Originalitaet, Kompatibilität und Projektregeln vor der Veroeffentlichung. Nutze es spielerisch oder zur Ideenfindung; ",built_dist,PASS
B04,21,random-word-generator,pt,gerador de random word,gerador-random-word,https://taptogen.com/pt/tools/gerador-random-word/,Gerador de Random Word,Gerador de Random Word gratis,"Crie rascunhos claros em português e revise cada resultado antes de usar. Revise precisao, originalidade, compatibilidade e regras do projeto antes de publicar. Mantenha como brincadeira ou ideacao; evite identidade, doc",built_dist,PASS
B04,21,random-word-generator,it,generatore di random word,generatore-random-word,https://taptogen.com/it/tools/generatore-random-word/,Generatore di Random Word,Generatore di Random Word gratis,"Crea bozze chiare in italiano e controlla ogni risultato prima di usarlo. Controlla accuratezza, originalità, compatibilità e regole del progetto prima della pubblicazione. Usalo per gioco o brainstorming; evita identità",built_dist,PASS
B04,21,random-word-generator,pl,generator random word,generator-random-word,https://taptogen.com/pl/tools/generator-random-word/,Generator Random Word,Generator Random Word za darmo,"Twórz jasne wersje robocze po polsku i sprawdźaj wynik przed użyciem. Sprawdź dokładność, oryginalność, zgodność i zasady projektu przed publikacją. Uzywaj do zabawy lub pomysłów; unikaj tozsamosci, dokumentow, nekania l",built_dist,PASS
B04,21,random-word-generator,ru,generator random word,generator-random-word,https://taptogen.com/ru/tools/generator-random-word/,Generator Random Word,Generator Random Word besplatno,"Sozdavaite ponyatnye chernoviki na russkom i proveriaite rezultat pered ispolzovaniem. Proverte tochnost, originalnost, sovmestimost i pravila proekta pered publikatsiei. Ispolzuyte dlya igry ili idei; izbegajte lichnost",built_dist,PASS
B04,21,random-word-generator,tr,olusturucu random word,olusturucu-random-word,https://taptogen.com/tr/tools/olusturucu-random-word/,Olusturucu Random Word,Olusturucu Random Word ucretsiz,"Turkce net taslaklar olusturun ve kullanmadan once sonucu kontrol edin. Yayinlamadan once dogruluk, ozgunluk, uyumluluk ve proje kurallarini kontrol edin. Oyun veya fikir uretimi icin kullanin; kimlik, belge, taciz veya ",built_dist,PASS
B04,21,random-word-generator,id,generator random word,generator-random-word,https://taptogen.com/id/tools/generator-random-word/,Generator Random Word,Generator Random Word gratis,"Buat draf yang jelas dalam bahasa Indonesia dan tinjau hasil sebelum digunakan. Periksa akurasi, orisinalitas, kompatibilitas, dan aturan proyek sebelum menerbitkan. Gunakan untuk bermain atau ide awal; hindari identitas",built_dist,PASS
B04,21,random-word-generator,sv,generator for random word,generator-random-word,https://taptogen.com/sv/tools/generator-random-word/,Generator for Random Word,Generator for Random Word gratis,"Skapa tydliga utkast pa svenska och granska resultatet innan du anvander det. Kontrollera noggrannhet, originalitet, kompatibilitet och projektregler fore publicering. Anvand for lek eller ideer; undvik identitet, dokume",built_dist,PASS
B04,21,random-word-generator,ms,penjana random word,penjana-random-word,https://taptogen.com/ms/tools/penjana-random-word/,Penjana Random Word,Penjana Random Word percuma,"Cipta draf jelas dalam Bahasa Melayu dan semak hasil sebelum digunakan. Semak ketepatan, keaslian, keserasian dan peraturan projek sebelum diterbitkan. Guna untuk bermain atau idea; elakkan identiti, dokumen, gangguan at",built_dist,PASS
B04,21,random-word-generator,bg,generator za random word,generator-random-word,https://taptogen.com/bg/tools/generator-random-word/,Generator za Random Word,Generator za Random Word bezplatno,"Sazdavaite yasni cherнови na balgarski i proveriavaite rezultata predi upotreba. Proverete tochnost, originalnost, savmestimost i pravilata na proekta predi publikuvane. Izpolzvaite za igra ili idei; izbqgvaite identichn",built_dist,PASS
B04,21,random-word-generator,hi,random word जनरेटर,generator-random-word,https://taptogen.com/hi/tools/generator-random-word/,Random Word जनरेटर,Random Word जनरेटर मुफ्त,"हिंदी में साफ ड्राफ्ट बनाएं और उपयोग से पहले हर परिणाम की समीक्षा करें. प्रकाशन से पहले सटीकता, मौलिकता, संगतता और प्रोजेक्ट नियम जांचें. Ise play ya brainstorming ke liye rakhein; identity, documents, harassment ya soci",built_dist,PASS
B04,21,random-word-generator,bn,random word জেনারেটর,generator-random-word,https://taptogen.com/bn/tools/generator-random-word/,Random Word জেনারেটর,Random Word জেনারেটর ফ্রি,"বাংলায় পরিষ্কার খসড়া তৈরি করুন এবং ব্যবহারের আগে ফলাফল পর্যালোচনা করুন. প্রকাশের আগে নির্ভুলতা, মৌলিকতা, সামঞ্জস্য এবং প্রকল্পের নিয়ম যাচাই করুন. Play ba brainstorming er jonno use korun; identity, documents, harassment ",built_dist,PASS
B04,21,random-word-generator,ja,random word ジェネレーター,generator-random-word,https://taptogen.com/ja/tools/generator-random-word/,Random Word ジェネレーター,Random Word ジェネレーター 無料,"日本語でわかりやすい下書きを作り、使う前に結果を確認します. 公開前に正確性、独自性、互換性、プロジェクト規則を確認してください. Play ya brainstorming ni todome, identity, documents, harassment, social pressure wo sakete kudasai.",built_dist,PASS
B04,21,random-word-generator,ko,random word 생성기,generator-random-word,https://taptogen.com/ko/tools/generator-random-word/,Random Word 생성기,Random Word 생성기 무료,"한국어로 명확한 초안을 만들고 사용 전에 결과를 검토하세요. 게시 전에 정확성, 독창성, 호환성, 프로젝트 규칙을 확인하세요. Play na brainstorming yongdo ro sayonghago identity, documents, harassment, social pressure reul pihaseyo.",built_dist,PASS
B04,21,random-word-generator,ar,مولد random word,muwallid-random-word,https://taptogen.com/ar/tools/muwallid-random-word/,مولد Random Word,مولد Random Word مجانا,أنشئ مسودات عربية واضحة وراجع كل نتيجة قبل استخدامها. راجع الدقة والأصالة والتوافق وقواعد المشروع قبل النشر. Istakhdimha liltarfih aw alafkar watajanab alhawiyah walwathaiq waliza aw aldaght alijtimaei.,built_dist,PASS
B04,22,dialogue-tag-generator,es,generador de dialogue tag,generador-dialogue-tag,https://taptogen.com/es/tools/generador-dialogue-tag/,Generador de Dialogue Tag,Generador de Dialogue Tag gratis,"Crea borradores claros en español y revisa cada resultado antes de usarlo. Revisa exactitud, originalidad, compatibilidad y reglas del proyecto antes de publicar. Comprueba originalidad, sensibilidad, derechos y disponib",built_dist,PASS
B04,22,dialogue-tag-generator,fr,générateur de dialogue tag,generateur-dialogue-tag,https://taptogen.com/fr/tools/generateur-dialogue-tag/,Générateur de Dialogue Tag,Générateur de Dialogue Tag gratuit,"Créez des brouillons clairs en français et vérifiez chaque resultat avant usage. Verifiez exactitude, originalité, compatibilité et regles du projet avant publication. Verifiez originalité, sensibilite, droits et disponi",built_dist,PASS
B04,22,dialogue-tag-generator,de,generator für dialogue tag,generator-dialogue-tag,https://taptogen.com/de/tools/generator-dialogue-tag/,Generator für Dialogue Tag,Generator für Dialogue Tag kostenlos,"Erstelle klare Entwürfe auf Deutsch und prüfe jedes Ergebnis vor der Nutzung. Prüfe Genauigkeit, Originalitaet, Kompatibilität und Projektregeln vor der Veroeffentlichung. Prüfe Originalitaet, Sensibilitaet, Rechte ",built_dist,PASS
B04,22,dialogue-tag-generator,pt,gerador de dialogue tag,gerador-dialogue-tag,https://taptogen.com/pt/tools/gerador-dialogue-tag/,Gerador de Dialogue Tag,Gerador de Dialogue Tag gratis,"Crie rascunhos claros em português e revise cada resultado antes de usar. Revise precisao, originalidade, compatibilidade e regras do projeto antes de publicar. Verifique originalidade, sensibilidade, direitos e disponib",built_dist,PASS
B04,22,dialogue-tag-generator,it,generatore di dialogue tag,generatore-dialogue-tag,https://taptogen.com/it/tools/generatore-dialogue-tag/,Generatore di Dialogue Tag,Generatore di Dialogue Tag gratis,"Crea bozze chiare in italiano e controlla ogni risultato prima di usarlo. Controlla accuratezza, originalità, compatibilità e regole del progetto prima della pubblicazione. Controlla originalità, sensibilita, diritti e d",built_dist,PASS
B04,22,dialogue-tag-generator,pl,generator dialogue tag,generator-dialogue-tag,https://taptogen.com/pl/tools/generator-dialogue-tag/,Generator Dialogue Tag,Generator Dialogue Tag za darmo,"Twórz jasne wersje robocze po polsku i sprawdźaj wynik przed użyciem. Sprawdź dokładność, oryginalność, zgodność i zasady projektu przed publikacją. Sprawdź oryginalność, wrazliwosc, prawa i dostępność przed publicznym u",built_dist,PASS
B04,22,dialogue-tag-generator,ru,generator dialogue tag,generator-dialogue-tag,https://taptogen.com/ru/tools/generator-dialogue-tag/,Generator Dialogue Tag,Generator Dialogue Tag besplatno,"Sozdavaite ponyatnye chernoviki na russkom i proveriaite rezultat pered ispolzovaniem. Proverte tochnost, originalnost, sovmestimost i pravila proekta pered publikatsiei. Proverte originalnost, delikatnost, prava i dostu",built_dist,PASS
B04,22,dialogue-tag-generator,tr,olusturucu dialogue tag,olusturucu-dialogue-tag,https://taptogen.com/tr/tools/olusturucu-dialogue-tag/,Olusturucu Dialogue Tag,Olusturucu Dialogue Tag ucretsiz,"Turkce net taslaklar olusturun ve kullanmadan once sonucu kontrol edin. Yayinlamadan once dogruluk, ozgunluk, uyumluluk ve proje kurallarini kontrol edin. Halka acik kullanimdan once ozgunluk, hassasiyet, haklar ve uygun",built_dist,PASS
B04,22,dialogue-tag-generator,id,generator dialogue tag,generator-dialogue-tag,https://taptogen.com/id/tools/generator-dialogue-tag/,Generator Dialogue Tag,Generator Dialogue Tag gratis,"Buat draf yang jelas dalam bahasa Indonesia dan tinjau hasil sebelum digunakan. Periksa akurasi, orisinalitas, kompatibilitas, dan aturan proyek sebelum menerbitkan. Periksa orisinalitas, sensitivitas, hak, dan ketersedi",built_dist,PASS
B04,22,dialogue-tag-generator,sv,generator for dialogue tag,generator-dialogue-tag,https://taptogen.com/sv/tools/generator-dialogue-tag/,Generator for Dialogue Tag,Generator for Dialogue Tag gratis,"Skapa tydliga utkast pa svenska och granska resultatet innan du anvander det. Kontrollera noggrannhet, originalitet, kompatibilitet och projektregler fore publicering. Kontrollera originalitet, kanslighet, rattigheter oc",built_dist,PASS
B04,22,dialogue-tag-generator,ms,penjana dialogue tag,penjana-dialogue-tag,https://taptogen.com/ms/tools/penjana-dialogue-tag/,Penjana Dialogue Tag,Penjana Dialogue Tag percuma,"Cipta draf jelas dalam Bahasa Melayu dan semak hasil sebelum digunakan. Semak ketepatan, keaslian, keserasian dan peraturan projek sebelum diterbitkan. Semak keaslian, sensitiviti, hak dan ketersediaan sebelum penggunaan",built_dist,PASS
B04,22,dialogue-tag-generator,bg,generator za dialogue tag,generator-dialogue-tag,https://taptogen.com/bg/tools/generator-dialogue-tag/,Generator za Dialogue Tag,Generator za Dialogue Tag bezplatno,"Sazdavaite yasni cherнови na balgarski i proveriavaite rezultata predi upotreba. Proverete tochnost, originalnost, savmestimost i pravilata na proekta predi publikuvane. Proverete originalnost, chuvstvitelnost, prava i d",built_dist,PASS
B04,22,dialogue-tag-generator,hi,dialogue tag जनरेटर,generator-dialogue-tag,https://taptogen.com/hi/tools/generator-dialogue-tag/,Dialogue Tag जनरेटर,Dialogue Tag जनरेटर मुफ्त,"हिंदी में साफ ड्राफ्ट बनाएं और उपयोग से पहले हर परिणाम की समीक्षा करें. प्रकाशन से पहले सटीकता, मौलिकता, संगतता और प्रोजेक्ट नियम जांचें. Public use se pehle originality, sensitivity, rights aur availability check karein",built_dist,PASS
B04,22,dialogue-tag-generator,bn,dialogue tag জেনারেটর,generator-dialogue-tag,https://taptogen.com/bn/tools/generator-dialogue-tag/,Dialogue Tag জেনারেটর,Dialogue Tag জেনারেটর ফ্রি,"বাংলায় পরিষ্কার খসড়া তৈরি করুন এবং ব্যবহারের আগে ফলাফল পর্যালোচনা করুন. প্রকাশের আগে নির্ভুলতা, মৌলিকতা, সামঞ্জস্য এবং প্রকল্পের নিয়ম যাচাই করুন. Public use er age originality, sensitivity, rights ebong availability chec",built_dist,PASS
B04,22,dialogue-tag-generator,ja,dialogue tag ジェネレーター,generator-dialogue-tag,https://taptogen.com/ja/tools/generator-dialogue-tag/,Dialogue Tag ジェネレーター,Dialogue Tag ジェネレーター 無料,"日本語でわかりやすい下書きを作り、使う前に結果を確認します. 公開前に正確性、独自性、互換性、プロジェクト規則を確認してください. Koukai riyou mae ni originality, hairyo, rights, availability wo kakunin shite kudasai. Draft wa ningen no handan de henshu shi, guaranteed ya official re",built_dist,PASS
B04,22,dialogue-tag-generator,ko,dialogue tag 생성기,generator-dialogue-tag,https://taptogen.com/ko/tools/generator-dialogue-tag/,Dialogue Tag 생성기,Dialogue Tag 생성기 무료,"한국어로 명확한 초안을 만들고 사용 전에 결과를 검토하세요. 게시 전에 정확성, 독창성, 호환성, 프로젝트 규칙을 확인하세요. Public use jeone originality, sensitivity, rights, availability reul hwaginhaseyo. Draft neun human judgement ro pyeonjiphago guaranteed na official ",built_dist,PASS
B04,22,dialogue-tag-generator,ar,مولد dialogue tag,muwallid-dialogue-tag,https://taptogen.com/ar/tools/muwallid-dialogue-tag/,مولد Dialogue Tag,مولد Dialogue Tag مجانا,أنشئ مسودات عربية واضحة وراجع كل نتيجة قبل استخدامها. راجع الدقة والأصالة والتوافق وقواعد المشروع قبل النشر. Tahaqqaq min alasalah walhusasiyah walhuquq waltawafur qabla alistikhdam alam. Harrir almusawadah bihukm bashar,built_dist,PASS
B04,23,name-tag-generator,es,generador de name tag,generador-name-tag,https://taptogen.com/es/tools/generador-name-tag/,Generador de Name Tag,Generador de Name Tag gratis,"Crea borradores claros en español y revisa cada resultado antes de usarlo. Revisa exactitud, originalidad, compatibilidad y reglas del proyecto antes de publicar. Usalo como ayuda práctica y confirma el resultado antes d",built_dist,PASS
